{
  "schema": "agent-action-request",
  "request_id": "action_req_evt_d9aa38bdc636459c92ea4e25f665cd0d_note",
  "event_id": "evt_d9aa38bdc636459c92ea4e25f665cd0d",
  "created_at": "2026-05-20T03:12:00Z",
  "requested_action": "create_apple_note",
  "stage": "staged",
  "execution_state": "not_executed",
  "requires_human_approval": true,
  "source_draft_id": "draft_evt_d9aa38bdc636459c92ea4e25f665cd0d_summary",
  "destination": "apple_notes",
  "safety_boundaries": [
    "stage_only",
    "human_review_required",
    "no_external_execution",
    "no_autonomous_dispatch",
    "sqlite_canonical"
  ],
  "provenance": {
    "source": "sqlite_audit_chain",
    "source_fields": ["events", "agent_drafts", "agent_action_requests"]
  }
}
